Company Name,Job Title,Job Title Normalize,Job URL,Job Description
Cognism,"Sales Manager, Commercial",Sales Manager,https://www.linkedin.com/jobs/view/sales-manager-commercial-at-cognism-4223389773,"<strong>Who Are We<br/><br/></strong>Cognism is the leading provider of European B2B data and sales intelligence. Ambitious businesses of every size use our platform to discover, connect, and engage with qualified decision-makers faster and close more deals. Headquartered in London with global offices, Cognism’s contact data and contextual signals are trusted by thousands of revenue teams to eliminate the guesswork from prospecting.<br/><br/><strong> OUR WORK MODEL <br/><br/></strong><strong> Hybrid </strong> : This is a hybrid role, requiring you to work from our London office a minimum of 3 days per week, with flexibility to work remotely on other days.<br/><br/><strong> YOUR ROLE <br/><br/></strong>As a <strong> Sales Manager, Commercial </strong> you’ll be joining a high-impact leadership team at the heart of our sales engine, playing a key role in helping Cognism scale to the next level.<br/><br/>You will lead and inspire a team of high-performing Account Executives focused on one of our key growth segments. Your mission is to drive consistent quota attainment, improve sales execution, and elevate team performance through strategic coaching, rigorous pipeline management, and operational discipline.<br/><br/>You will collaborate closely with Sales Leadership, Marketing, and RevOps to ensure your team is aligned, enabled, and equipped to exceed targets and deliver exceptional value to our customers.<br/><br/>This is a highly visible role with the opportunity to shape team performance and contribute to strategic growth across a core commercial area.<br/><br/><strong> YOUR CHALLENGES &amp; OPPORTUNITIES <br/><br/></strong><ul><li> Lead &amp; Develop High-Performing Teams - Coach and manage a team of 5 Account Executives, fostering a culture of ownership, execution, and continuous improvement. </li><li> Drive Sales Execution - Implement effective sales methodologies and deal progression strategies to improve win rates and shorten sales cycles. </li><li> Own Pipeline Performance - Ensure each AE contributes ~25% of their own pipeline through strategic outbound activity, complemented by tight alignment with Marketing and Sales Development. </li><li> Champion Operational Excellence - Monitor and act on key metrics like pipeline coverage, forecast accuracy, and sales velocity to boost team performance. </li><li> Enhance Cross-Functional Alignment - Work closely with Marketing, RevOps, and Product to optimise campaign impact, improve lead quality, and influence roadmap decisions. </li><li> Uplift Market &amp; Product Positioning - Develop deep product and customer knowledge to support objection handling, urgency creation, and strategic selling. </li><li> Support Retention &amp; Growth - Play an active role in team career development, recognition, and long-term retention planning. <br/><br/></li></ul><strong> OUR EXPECTATIONS <br/><br/></strong><ul><li> Sales Leadership Experience - 2+ years leading Account Executives or full-cycle sellers in a B2B SaaS environment, with a consistent track record of exceeding revenue targets. </li><li> Commercial Segment Expertise - Proven success closing deals with growth-stage companies (typically 51–200 employees), with AOVs of $15k but up to $100k+ with multi-stakeholder sales cycles. </li><li> Sales Methodology Expertise - Strong command of modern frameworks like MEDDPICC, Challenger or Sandler, and applying them to drive deal progression and forecast accuracy. </li><li> Data-Driven Operator - Strong analytical skills with the ability to interpret performance data, identify trends, and take decisive action. </li><li> People-First Manager - Proven coaching ability with high emotional intelligence and a focus on developing high-performing, engaged teams. </li><li> Cross-Functional Collaborator - Skilled in working across Marketing, RevOps, and Product to improve pipeline quality, sales process, and customer outcomes. </li><li> Adaptable &amp; Globally Minded – Comfortable navigating dynamic business needs, diverse teams, and an evolving global sales environment. <br/><br/></li></ul><strong>WHY COGNISM<br/><br/></strong>At Cognism, we’re not just building a company - we’re building an inclusive community of brilliant, diverse people who <strong>support, challenge, and inspire each other every day</strong>. If you’re looking for a place where your work truly <strong>makes an impact</strong>, you’re in the right spot!<br/><br/>Our values aren’t just words on a page—they guide how we work, how we treat each other, and how we grow together. They shape our culture, drive our success, and ensure that everyone feels valued, heard, and empowered to do their best work.<br/><br/><strong>Here’s What We Stand For<br/><br/></strong> <strong>We Are Nice!</strong> We treat each other with respect and kindness (because life’s too short for anything else).<br/><br/> <strong>We Are Collaborative.</strong> We’re in this together—great things happen when we work as one.<br/><br/> <strong>We Are Solution-Focused.</strong> Every challenge is just an opportunity in disguise.<br/><br/> <strong>We Are Understanding.</strong> We empower and support each other to do our best work.<br/><br/> <strong>We Celebrate Individual Contributors.</strong> Every role matters, and so do you!<br/><br/>At Cognism, we are committed to fostering an inclusive, diverse, and supportive workplace. Our values—Being Nice, Collaborative, Solution-Focused, and Understanding—guide everything we do, and we celebrate Individual Contributors. We welcome applications from individuals typically underrepresented in tech, so if this role excites you but you’re unsure if you meet every requirement, we encourage you to apply!"
Cognism,Customer Success Representative,Customer Representative,https://www.linkedin.com/jobs/view/customer-success-representative-at-cognism-4260950594,"<strong>Who Are We<br/><br/></strong>Cognism is the leading provider of European B2B data and sales intelligence. Ambitious businesses of every size use our platform to discover, connect, and engage with qualified decision-makers faster and close more deals. Headquartered in London with global offices, Cognism’s contact data and contextual signals are trusted by thousands of revenue teams to eliminate the guesswork from prospecting.<br/><br/><strong>OUR WORK MODEL<br/><br/></strong><strong>Hybrid:</strong> This is a hybrid role, requiring you to work from our location office 3 days per week (subject to change, dependant on business needs), with flexibility to work remotely on other days.<br/><br/><strong>YOUR ROLE<br/><br/></strong>As a <strong>Customer Success Representative</strong>, you will help drive clients’ revenue goals with our platform. In this high-growth, fast-paced environment, your expertise will drive operational excellence and risk mitigation at Cognism.<br/><br/><strong>YOUR CHALLENGES &amp; OPPORTUNITIES<br/><br/></strong><ul><li>Relationship Management - Serve as the main point of contact for clients post-sale; Build strong relationships with key stakeholders and understand their data needs and business goals; Monitor account health and proactively address issues.</li><li>Customer Communication &amp; Updates - Provide clear, timely updates on issue resolution or product enhancements; maintain positive, professional communication with stakeholders and end users.</li><li>Account Monitoring &amp; Usage Tracking - Monitor customer data usage; identify patterns that may signal a risk of churn or need for support.</li><li>Training &amp; Education - Assist customers with continual education as needed, self-service portals; guide admins through how to use dashboards, stay up-to-date user interactions, address questions/challenges as they arise.</li><li>Customer Feedback &amp; Reporting - Collect and relay customer feedback to product and data teams; help gather evidence or use cases that show value delivered to clients, assist in periodic customer health checks or satisfaction surveys.</li><li>Customer Retention - Monitor customer health scores, usage patterns, and engagement signals to identify risk or opportunity, proactively identify opportunities around Go-To-Market changes, expanded licenses; prevent churn through proactive engagement and value reinforcement; providing solutions for usage or satisfaction issues<br/><br/></li></ul><strong>OUR EXPECTATIONS<br/><br/></strong><ul><li>Professional Experience – 2+ years in a sales organization</li><li>Industry Background – Prior experience in a tech company, SaaS, or start-up environment is highly desirable.</li><li>Leadership &amp; Communication – Ability to engage and advise stakeholders at all levels, translating objectives into actionable insights.</li><li>Problem-Solving Mindset – Proactive, solution-oriented, and adaptable to a fast-paced, high-growth environment.</li><li>Detail-Oriented &amp; Organized – Strong project management skills with a keen eye for accuracy and compliance best practices for multiple clients at a time</li><li>Commercial Aptitude - Ability to align to gain a strong understanding of the customer’s business needs, market dynamics, and how to translate product value into measurable ROI to ensure customer retention.</li><li>Fluency in English – Strong written, verbal, and presentation skills, with the ability to clearly communicate complex ideas to diverse audiences<br/><br/></li></ul><strong>OUR TECH STACK<br/><br/></strong><ul><li>Customer Success Platform (e.g. Gainsight, ChurnZero, Vitally) – Helps organize, track and main efficient communications with clients, understand usage trends, create</li><li>Conversational intelligence tools (e.g. Gong.io, Chorus.ai, DialPad) – Helps aid coaching, tracking conversations, sharing information to internal teams directly from the client</li><li>Automation tools (e.g. Outreach, SalesLoft, Vymo) – Helps to organize mass outreach across full customer base.</li><li>Communication tools (e.g. Zoom, MSFT Teams, Slack,) – To effectively communicate with customers and internal contacts, gage reactions, track messages.</li><li>Proficient with Salesforce - Manage customer relationships, streamline sales processes, automate marketing, and provide customer service<br/><br/></li></ul><strong>WHY COGNISM<br/><br/></strong>At Cognism, we’re not just building a company - we’re building an inclusive community of brilliant, diverse people who <strong>support, challenge, and inspire each other every day</strong>. If you’re looking for a place where your work truly <strong>makes an impact</strong>, you’re in the right spot!<br/><br/>Our values aren’t just words on a page—they guide how we work, how we treat each other, and how we grow together. They shape our culture, drive our success, and ensure that everyone feels valued, heard, and empowered to do their best work.<br/><br/><strong>Here’s What We Stand For<br/><br/></strong> <strong>We Are Nice!</strong> We treat each other with respect and kindness (because life’s too short for anything else).<br/><br/> <strong>We Are Collaborative.</strong> We’re in this together—great things happen when we work as one.<br/><br/> <strong>We Are Solution-Focused.</strong> Every challenge is just an opportunity in disguise.<br/><br/> <strong>We Are Understanding.</strong> We empower and support each other to do our best work.<br/><br/> <strong>We Celebrate Individual Contributors.</strong> Every role matters, and so do you!<br/><br/>At Cognism, we are committed to fostering an inclusive, diverse, and supportive workplace. Our values—Being Nice, Collaborative, Solution-Focused, and Understanding—guide everything we do, and we celebrate Individual Contributors. We welcome applications from individuals typically underrepresented in tech, so if this role excites you but you’re unsure if you meet every requirement, we encourage you to apply!"
Cognism,Customer Success Manager (French Speaker),Customer Success Manager,https://www.linkedin.com/jobs/view/customer-success-manager-french-speaker-at-cognism-4250566130,"<strong>Who Are We<br/><br/></strong>Cognism is the leading provider of European B2B data and sales intelligence. Ambitious businesses of every size use our platform to discover, connect, and engage with qualified decision-makers faster and close more deals. Headquartered in London with global offices, Cognism’s contact data and contextual signals are trusted by thousands of revenue teams to eliminate the guesswork from prospecting.<br/><br/><strong> OUR WORK MODEL <br/><br/></strong>Hybrid: This is a hybrid role, requiring you to work from our London office 3 days per week, with flexibility to work remotely on other days.<br/><br/><strong> YOUR ROLE <br/><br/></strong>As a <strong> Customer Success Manager (Fluent French Speaker) </strong> at Cognism, you'll join a dynamic, commercially driven, and customer-obsessed team.<br/><br/>Your mission is to help French speaking customers achieve tangible ROI from our platform — driving adoption, retention, and long-term growth. You’ll act as a trusted advisor, aligning Cognism’s solutions with your customers’ strategic goals, and will be central to the success of our global client base.<br/><br/>NOTE - This role requires fluency in both French and English at a business level as you will support a portfolio of French-speaking customers across EMEA.<br/><br/><strong> YOUR CHALLENGES &amp; OPPORTUNITIES <br/><br/></strong><ul><li> Be a Strategic Partner – Understand your customers’ business objectives and build strategic success plans to help them achieve short- and long-term goals. </li><li> Drive Adoption &amp; Retention – Maximise customer satisfaction and platform engagement across your portfolio, proactively identifying risks and opportunities. </li><li> Deliver Impactful SBRs – Lead strategic business reviews with clear metrics for success, ensuring alignment between customer goals and Cognism’s value. </li><li> Resolve Issues with Impact – Act as the first point of contact for escalations and work cross-functionally to ensure timely resolution. </li><li> Consult on Solutions – Design bespoke success strategies and consultative solutions tailored to enterprise customers. </li><li> Share Best Practices – Collaborate with internal and external stakeholders to surface insights, trends, and best practices that accelerate customer success. </li><li> Unlock Revenue Opportunities – Identify cross-sell and upsell opportunities that drive ROI and deepen customer relationships. </li><li> Be a Voice of the Customer – Continuously assess and advocate for your customers’ evolving needs, ensuring Cognism remains a strategic partner. </li><li> Mentor &amp; Collaborate – Support onboarding of new team members and contribute to broader team development where relevant. </li><li> Shape the Customer Journey – Engage in pre-sales conversations when needed to ensure a seamless transition into post-sale success. <br/><br/></li></ul><strong> OUR EXPECTATIONS <br/><br/></strong><ul><li> Experienced Operator – 2+ years in a Customer Success, Customer Experience or Account Management role, ideally in a B2B SaaS environment. </li><li> Fluent French &amp; English Speaker – You must be comfortable communicating and presenting in both French and English at a professional level. </li><li> Trusted Communicator – Outstanding presentation, active listening, and stakeholder management skills. </li><li> Customer Obsessed – Personable and consultative, with a passion for helping clients succeed. </li><li> Detail-Oriented Multitasker – Skilled at managing multiple accounts and priorities with precision. </li><li> Self-Starter – Comfortable working autonomously, taking ownership, and driving outcomes under pressure. </li><li> Commercially Minded – Results-driven, with the ability to connect platform usage to customer ROI. <br/><br/></li></ul><strong>WHY COGNISM<br/><br/></strong>At Cognism, we’re not just building a company - we’re building an inclusive community of brilliant, diverse people who <strong>support, challenge, and inspire each other every day</strong>. If you’re looking for a place where your work truly <strong>makes an impact</strong>, you’re in the right spot!<br/><br/>Our values aren’t just words on a page—they guide how we work, how we treat each other, and how we grow together. They shape our culture, drive our success, and ensure that everyone feels valued, heard, and empowered to do their best work.<br/><br/><strong>Here’s What We Stand For<br/><br/></strong> <strong>We Are Nice!</strong> We treat each other with respect and kindness (because life’s too short for anything else).<br/><br/> <strong>We Are Collaborative.</strong> We’re in this together—great things happen when we work as one.<br/><br/> <strong>We Are Solution-Focused.</strong> Every challenge is just an opportunity in disguise.<br/><br/> <strong>We Are Understanding.</strong> We empower and support each other to do our best work.<br/><br/> <strong>We Celebrate Individual Contributors.</strong> Every role matters, and so do you!<br/><br/>At Cognism, we are committed to fostering an inclusive, diverse, and supportive workplace. Our values—Being Nice, Collaborative, Solution-Focused, and Understanding—guide everything we do, and we celebrate Individual Contributors. We welcome applications from individuals typically underrepresented in tech, so if this role excites you but you’re unsure if you meet every requirement, we encourage you to apply!"
Cognism,Sales Development Representative,Sales Development Representative,https://www.linkedin.com/jobs/view/sales-development-representative-at-cognism-4255726233,"<strong>Who Are We<br/><br/></strong>Cognism is the leading provider of European B2B data and sales intelligence. Ambitious businesses of every size use our platform to discover, connect, and engage with qualified decision-makers faster and close more deals. Headquartered in London with global offices, Cognism’s contact data and contextual signals are trusted by thousands of revenue teams to eliminate the guesswork from prospecting.<br/><br/><strong>OUR WORK MODEL<br/><br/></strong>Office-Based: This is an office-based role. During your initial training period, you will be required to work in the office five days a week. Once you have successfully ramped up, you will have the option to work in the office four days per week.<br/><br/><strong>YOUR ROLE<br/><br/></strong>As a Sales Development Representative (SDR) at Cognism, you will play a crucial role in driving our growth by identifying and generating new business opportunities. Your responsibilities will include proactively booking meetings, engaging with key decision-makers, and managing a pipeline to contribute directly to the sales team's success. This role is ideal for someone ambitious, driven, and eager to thrive in a fast-paced, results-oriented environment.<br/><br/><strong>YOUR CHALLENGES &amp; OPPORTUNITIES<br/><br/></strong><strong>Generate Business Opportunities</strong> – Book outbound meetings through a combination of cold calls, emails, social outreach, networking, and independent research.<br/><br/><strong>Engage Key Stakeholders</strong> – Engage with C-suite and Director-level prospects to effectively communicate the value of our product.<br/><br/><strong>Conduct Discovery &amp; Qualify Leads</strong> – Evaluate prospect pain points through discovery conversations and qualify leads for sales conversion.<br/><br/><strong>Deliver Relevant Content</strong> – Share impactful marketing content tailored to the needs of prospects to drive engagement.<br/><br/><strong>Build Relationships</strong> – Establish trust with key stakeholders and maintain a proactive approach to relationship-building.<br/><br/><strong>Manage Sales Pipeline</strong> – Generate, manage, and update the sales pipeline in Salesforce, ensuring a seamless transition to the sales team.<br/><br/><strong>Collaborate with BDMs</strong> – Work alongside Business Development Managers (BDMs) to convert opportunities into qualified sales leads.<br/><br/><strong>Maintain Positive Mindset</strong> – Stay resilient and positive in challenging situations, always keeping a focus on results.<br/><br/><strong>Continuous Learning &amp; Improvement</strong> – Be proactive in learning new tools, technologies, and strategies to enhance your performance.<br/><br/><strong>OUR EXPECTATIONS<br/><br/></strong><strong>Bachelor’s Degree or Relevant Experience</strong> – A degree or equivalent experience in a relevant field is required.<br/><br/><strong>Evidence of Overachievement</strong> – A track record of exceeding targets and performance expectations in previous roles.<br/><br/><strong>Sales Experience (Preferred)</strong> – Sales experience is preferred but not essential.<br/><br/><strong>Strong Communication Skills</strong> – You can effectively articulate value to prospects, both verbally and in writing.<br/><br/><strong>Self-Motivation &amp; Initiative</strong> – Proactive and self-driven, with the ability to thrive independently and in a team.<br/><br/><strong>Analytical &amp; Problem-Solving</strong> – Strong ability to analyze prospects’ needs and identify suitable solutions.<br/><br/><strong>Emotional Intelligence</strong> – A high level of emotional intelligence and the ability to handle challenging situations with composure.<br/><br/><strong>Agility in a Scale-Up Environment</strong> – A can-do, adaptable attitude necessary to succeed in a fast-growing company.<br/><br/><strong>Time Management</strong> – Excellent time management skills, with the ability to prioritize and manage your workload effectively.<br/><br/><strong>Passion for Sales</strong> – A genuine passion for sales, eager to continuously develop and improve in the role.<br/><br/><strong>WHY COGNISM<br/><br/></strong>At Cognism, we’re not just building a company - we’re building an inclusive community of brilliant, diverse people who <strong>support, challenge, and inspire each other every day</strong>. If you’re looking for a place where your work truly <strong>makes an impact</strong>, you’re in the right spot!<br/><br/>Our values aren’t just words on a page—they guide how we work, how we treat each other, and how we grow together. They shape our culture, drive our success, and ensure that everyone feels valued, heard, and empowered to do their best work.<br/><br/><strong>Here’s What We Stand For<br/><br/></strong> <strong>We Are Nice!</strong> We treat each other with respect and kindness (because life’s too short for anything else).<br/><br/> <strong>We Are Collaborative.</strong> We’re in this together—great things happen when we work as one.<br/><br/> <strong>We Are Solution-Focused.</strong> Every challenge is just an opportunity in disguise.<br/><br/> <strong>We Are Understanding.</strong> We empower and support each other to do our best work.<br/><br/> <strong>We Celebrate Individual Contributors.</strong> Every role matters, and so do you!<br/><br/>At Cognism, we are committed to fostering an inclusive, diverse, and supportive workplace. Our values—Being Nice, Collaborative, Solution-Focused, and Understanding—guide everything we do, and we celebrate Individual Contributors. We welcome applications from individuals typically underrepresented in tech, so if this role excites you but you’re unsure if you meet every requirement, we encourage you to apply!"
