Company Name,Job Title,Job Title Normalize,Job URL,Job Description
ZoomInfo,Senior Data Scientist,Senior Data Scientist,https://www.linkedin.com/jobs/view/senior-data-scientist-at-zoominfo-4184833179,"<p>At ZoomInfo, we encourage creativity, value innovation, demand teamwork, expect accountability and cherish results. We value your take charge, take initiative, get stuff done attitude and will help you unlock your growth potential. One great choice can change everything. Thrive with us at ZoomInfo.</p> <p>Zoominfo is actively seeking a Senior Data Scientist to join our Enterprise Data Science team. In this strategic role, you will lead efforts to analyze and harness diverse datasets across our organization, with a primary focus on leveraging data science and machine learning to drive actionable insights and outcomes.</p><br/><p>Your responsibilities will encompass developing advanced data analytics models, implementing machine learning algorithms, and optimizing data pipelines. You will play a pivotal role in delivering data-driven solutions that enhance our products and operations, ultimately driving business growth.</p><br/><p>Collaboration with cross-functional teams, management, and senior leadership will be key as you translate complex data into actionable insights and strategies. We are looking for a visionary leader who is passionate about harnessing the power of data science and machine learning to solve complex business challenges and drive innovation.</p><br/><p>In this role, you'll craft crucial business inquiries, design data models, and spearhead the adoption of advanced data science methods. You'll need robust analytical capabilities, a profound passion for data science and machine learning, and the ability to effectively convey the significance of data-backed choices to a wide range of stakeholders.</p><br/><p><strong>What You'll do:</strong></p><br/><ul><br/><li><strong>Data-Driven Insights:</strong> Applying visionary business insight to identify and solve pivotal data science challenges with long-term organizational impact. Leading the development of novel methodologies and influencing key stakeholders to achieve transformational results.</li><br/><li><strong>ML and LLM Model Development:</strong> Utilize Machine Learning (ML) and Large Language Models (LLMs) to develop innovative AI solutions, including traditional machine learning algorithms, advanced retrieval-augmented generation (RAG) (e.g., Graph RAG and Agentic solutions), and marketing modeling (e.g., attribution modeling).</li><br/><li><strong>Deployment and Scalability:</strong> Collaborating with engineering teams, we deploy and integrate ML and Generative AI models into production systems, ensuring scalability, reliability, and efficiency.</li><br/><li><strong>Business Problem Solving:</strong> Pioneering innovative ML and Generative AI techniques to solve critical business problems. Setting technical direction and standards for AI systems across the organization, ensuring alignment with overarching business objectives.</li><br/><li><strong>AI Innovation:</strong> Build innovative new AI solutions, enhance existing models, drive continuous improvement, and keep us ahead of industry trends. Stay up to date with the latest developments in AI, deep learning, and NLP research. Promote a culture of continuous learning and knowledge sharing within the team. </li><br/><li><strong>Stakeholder Communication:</strong> Effectively communicate complex technical concepts and insights to non-technical stakeholders, guiding them in making informed decisions.</li><br/></ul><br/><p><strong>What you bring:</strong></p><br/><ul><br/><li>Ph.D. with 4+ years or Master's degree with 6+ years of industry experience in Data Science, Statistics, or a related field.</li><br/><li><strong>(Mandatory Requirements)</strong> Strong proficiency in statistical modeling, machine learning algorithms, NLP and LLM techniques, with the ability to apply these skills to solve complex business problems.</li><br/><li><strong>(Mandatory Requirements)</strong> Hands-on experience and strong proficiency with LLMs, including prompt engineering, advanced Retrieval-Augmented Generation (RAG) techniques, such as GraphRAG and Agentic Solutions. </li><br/><li>Proven ability to develop end-to-end ML pipelines, encompassing data preparation, model training, and inference, using cloud-based tools (such as Databricks and AWS).</li><br/><li>Demonstrated experience in architecting and implementing scalable data and model pipelines, with a focus on performance, maintainability, and scalability.</li><br/><li>Expertise in Python and SQL, along with experience in big data technologies and distributed computing frameworks (e.g., Spark).</li><br/><li>Excellent communication and storytelling skills, with the ability to collaborate effectively with cross-functional teams and influence decision-making at all levels of the organization. Ability to convey complex insights to diverse stakeholders.</li><br/><li>Hands-on experience with fine-tuning LLM is a plus.</li><br/></ul><br/><p> </p><br/><p><em><strong>Location: Toronto, ON (Hybrid)</strong></em></p><br/><p> </p><br/><p/><br/><p/> <p><strong>About us:</strong> </p><br/><p>ZoomInfo (NASDAQ: GTM) is the Go-To-Market Intelligence Platform that empowers businesses to grow faster with AI-ready insights, trusted data, and advanced automation. Its solutions provide more than 35,000 companies worldwide with a complete view of their customers, making every seller their best seller.</p><br/><p>ZoomInfo may use a software-based assessment as part of the recruitment process. More information about this tool, including the results of the most recent bias audit, is available here.</p><br/><p>ZoomInfo is proud to be an equal opportunity employer, hiring based on qualifications, merit, and business needs, and does not discriminate based on protected status. We welcome all applicants and are committed to providing equal employment opportunities regardless of sex, race, age, color, national origin, sexual orientation, gender identity, marital status, disability status, religion, protected military or veteran status, medical condition, or any other characteristic protected by applicable law. We also consider qualified candidates with criminal histories in accordance with legal requirements.</p><br/><p> </p><br/><p>For Massachusetts Applicants: It is unlawful in Massachusetts to require or administer a lie detector test as a condition of employment or continued employment. An employer who violates this law shall be subject to criminal penalties and civil liability. ZoomInfo does not administer lie detector tests to applicants in any location.</p>"
ZoomInfo,Manager - Accounts Payable,Accounts Payable Manager,https://www.linkedin.com/jobs/view/manager-accounts-payable-at-zoominfo-4266727195,"<p>At ZoomInfo, we encourage creativity, value innovation, demand teamwork, expect accountability and cherish results. We value your take charge, take initiative, get stuff done attitude and will help you unlock your growth potential. One great choice can change everything. Thrive with us at ZoomInfo.</p> <p><strong>About the Role:</strong></p><p>We are seeking an experienced <strong>Accounts Payable Manager</strong> to oversee day-to-day AP operations in our rapidly growing sales and marketing technology company. Reporting to the <strong>Controller</strong> and <strong>Senior Accounts Payable Manager</strong>, this role includes managing and mentoring a team of on-site AP Specialists, driving process improvements, and supporting month-end close activities.</p><p><strong>What You'll Do:</strong></p><ul><li>Lead, mentor, and support a team of on-site Accounts Payable Specialists, providing regular feedback and development opportunities</li><li>Investigate and resolve supplier inquiries and payment issues with a proactive approach</li><li>Maintain and improve AP process documentation to ensure alignment with SOX compliance; support onboarding and training of new team members</li><li>Perform monthly and quarterly close tasks, including accruals, reclassification entries, reconciliations, AP clearing, aging analysis, and manual payment entries</li><li>Manage ACH and wire payment setups across multiple entities</li><li>Monitor and report on key AP metrics, including payment performance and supplier onboarding effectiveness</li><li>Collaborate with Finance and Procurement teams on cross-functional initiatives</li><li>Assist with special projects and administrative tasks as assigned by the Senior Accounts Payable Manager</li></ul><p><strong>What You Bring:</strong></p><ul><li>Must reside in Chennai and be able to commute to the office on a hybrid schedule</li><li>8+ years of experience and minimum of 2 years in a supervisory or management role in Accounts Payable</li><li>Bachelor’s degree in accounting, finance, business, or related field</li><li>Strong knowledge of GAAP and familiarity with India’s taxation processes and regulations</li><li>Proficient in Microsoft Excel and Google Workspace (G-Suite)</li><li>Experience working with ERP and e-payables systems</li><li>Strong organizational and time management skills; ability to meet deadlines in a fast-paced environment</li><li>Excellent verbal and written communication skills</li></ul><p><strong>Preferred Skills:</strong></p><ul><li>Experience with systems such as <strong>Coupa, SAP, Brex</strong>, or similar AP automation tools</li><li>Prior experience working in a publicly traded company</li><li>Familiarity with foreign currency transactions</li><li>Strong attention to detail and analytical skills</li></ul> <p><strong>About us:</strong> </p><p>ZoomInfo (NASDAQ: GTM) is the Go-To-Market Intelligence Platform that empowers businesses to grow faster with AI-ready insights, trusted data, and advanced automation. Its solutions provide more than 35,000 companies worldwide with a complete view of their customers, making every seller their best seller.</p><p>ZoomInfo may use a software-based assessment as part of the recruitment process. More information about this tool, including the results of the most recent bias audit, is available here.</p><p>ZoomInfo is proud to be an equal opportunity employer, hiring based on qualifications, merit, and business needs, and does not discriminate based on protected status. We welcome all applicants and are committed to providing equal employment opportunities regardless of sex, race, age, color, national origin, sexual orientation, gender identity, marital status, disability status, religion, protected military or veteran status, medical condition, or any other characteristic protected by applicable law. We also consider qualified candidates with criminal histories in accordance with legal requirements.</p><p> </p><p>For Massachusetts Applicants: It is unlawful in Massachusetts to require or administer a lie detector test as a condition of employment or continued employment. An employer who violates this law shall be subject to criminal penalties and civil liability. ZoomInfo does not administer lie detector tests to applicants in any location.</p>"
ZoomInfo,Partner Operations Manager II,undefined,https://www.linkedin.com/jobs/view/partner-operations-manager-ii-at-zoominfo-4275702878,"<p>At ZoomInfo, we encourage creativity, value innovation, demand teamwork, expect accountability and cherish results. We value your take charge, take initiative, get stuff done attitude and will help you unlock your growth potential. One great choice can change everything. Thrive with us at ZoomInfo.</p> <p> </p><p><strong>About the role : </strong></p><p>We are seeking a detail-oriented and data-driven <strong>Partnership Operations Manager</strong> to support our growing partnerships function. This is an <strong>individual contributor</strong> role focused on <strong>operational excellence</strong>, where you will own the day-to-day administration, reporting, and process management of our <strong>partnerships and partner-led sales motions</strong>. Your role will be pivotal in ensuring our internal systems, reports, and workflows run smoothly, enabling strategic decision-making across the partnerships organization.</p><p><strong>What You'll Do:</strong></p><p><strong>Operational Support for Partnerships &amp; Partner Sales</strong></p><ul><li>Manage all administrative and backend processes related to partnership onboarding, enablement tracking, and pipeline hygiene.</li><li>Support partner-led sales workflows including data management, opportunity tracking, and internal system alignment (Google Sheets, SFDC).</li><li>Coordinate updates across cross-functional teams to ensure process consistency and data accuracy.</li></ul><p><strong>Reporting &amp; Analytics</strong></p><ul><li>Build and maintain Tableau dashboards and Google Sheet trackers to report on partner performance, sales contribution, and key metrics.</li><li>Provide timely, reliable, and actionable insights to the partnerships and sales leadership teams.</li><li>Automate recurring reports and streamline manual processes wherever possible.</li></ul><p><strong>CRM &amp; Data Management (SFDC)</strong></p><ul><li>Maintain clean and structured partner-related data in Salesforce.</li><li>Partner with RevOps to ensure accurate mapping of partner accounts, contacts, and deal attribution.</li><li>Identify and resolve data inconsistencies that impact reporting and business operations.</li></ul><p><strong>Cross-functional Coordination</strong></p><ul><li>Liaise with Sales, RevOps, Marketing, Finance, and Enablement teams to align on partnership processes and reporting needs.</li><li>Own documentation and knowledge management for partner operations workflows</li></ul><p><strong>What You Bring:</strong></p><ul><li>Fulltime Bachelors in Science / Engineering</li><li>3–5 years of experience in Sales/Partnership Operations, Revenue Operations, or similar roles.</li><li><strong>Shift : Mandatory Night Shift - 5PM to 2 AM IST</strong></li><li><strong>Hands-on experience with Tableau</strong> and advanced <strong>Google Sheets</strong> for reporting and visualization.</li><li>Strong working knowledge of <strong>Salesforce (SFDC)</strong> for managing and reporting on partner-related data.</li><li>High attention to detail and an organized, self-driven approach to managing multiple concurrent tasks.</li><li>Exposure to SaaS or technology industry environments.</li><li>Excellent communication skills and comfort collaborating across teams.</li><li>Prior experience supporting <strong>partnerships or channel sales</strong> would be great plus</li><li>Understanding of co-selling motions or partner lifecycle stages.</li></ul> <p><strong>About us:</strong> </p><p>ZoomInfo (NASDAQ: GTM) is the Go-To-Market Intelligence Platform that empowers businesses to grow faster with AI-ready insights, trusted data, and advanced automation. Its solutions provide more than 35,000 companies worldwide with a complete view of their customers, making every seller their best seller.</p><p>ZoomInfo may use a software-based assessment as part of the recruitment process. More information about this tool, including the results of the most recent bias audit, is available here.</p><p>ZoomInfo is proud to be an equal opportunity employer, hiring based on qualifications, merit, and business needs, and does not discriminate based on protected status. We welcome all applicants and are committed to providing equal employment opportunities regardless of sex, race, age, color, national origin, sexual orientation, gender identity, marital status, disability status, religion, protected military or veteran status, medical condition, or any other characteristic protected by applicable law. We also consider qualified candidates with criminal histories in accordance with legal requirements.</p><p> </p><p>For Massachusetts Applicants: It is unlawful in Massachusetts to require or administer a lie detector test as a condition of employment or continued employment. An employer who violates this law shall be subject to criminal penalties and civil liability. ZoomInfo does not administer lie detector tests to applicants in any location.</p>"
ZoomInfo,"Mid-Market, Emerging New Business Account Executive",undefined,https://www.linkedin.com/jobs/view/mid-market-emerging-new-business-account-executive-at-zoominfo-4227066721,"<p>At ZoomInfo, we encourage creativity, value innovation, demand teamwork, expect accountability and cherish results. We value your take charge, take initiative, get stuff done attitude and will help you unlock your growth potential. One great choice can change everything. Thrive with us at ZoomInfo.</p> <p>As a <strong>Mid Market, Emerging New Business Account Executive</strong>, you will drive the company’s growth through strategic engagement with medium-sized organizations, navigating their more complex decision-making structures to secure new business opportunities. In this role, you will focus on understanding the unique challenges and needs of mid-market clients, crafting customized solutions that deliver substantial value. Your success will be built on your ability to effectively manage full sales cycles, from initial contact through to deal closure, while orchestrating interactions with multiple stakeholders to achieve consensus and facilitate decision-making processes.</p><br/><p><strong>What You Will Do:</strong></p><br/><ul><br/><li>Proactively identify and cultivate relationships with potential clients within the mid-market space, focusing on organizations with 100 to 300 employees.</li><br/><li>Develop a deep understanding of the specific challenges related to the prospects go-to-market efforts and effectively position ZoomInfo solutions to solve the customer challenges..</li><br/><li>Manage sophisticated sales cycles that range from two weeks to six months. This includes deep discovery discussions, rich presentations, managing proof of concept requests, multi-threading accounts and building custom proposals among other steps. Executing with precision and alignment to the client's needs is critical.</li><br/><li>Employ a structured yet flexible sales approach that can adapt to various buying processes and timelines.</li><br/><li>Lead negotiations for deals ranging from $15k to over $100k, crafting proposals that meet both client expectations and company profitability goals.</li><br/><li>Navigate contract complexities to close deals efficiently while maintaining a focus on long-term client relationships.</li><br/><li>Engage and align multiple stakeholders within client organizations, including senior executives, ensuring consensus and fostering strong partnerships.</li><br/><li>Utilize excellent communication skills to articulate the value of solutions in meeting the client's strategic goals.</li><br/><li>Maintain a robust sales pipeline, accurately forecasting sales outcomes to meet and exceed quarterly and annual targets.</li><br/><li>Prospect into key target accounts to create new opportunities through strategic email outreach, cold calling and social networking to enrich the pipeline on top of inbound leads.</li><br/><li>This role includes a paired SDR, with two different types of opportunities within this group - one with inbound leads and one without - each with a corresponding quota to set you up for success.</li><br/><li>Collaboratively share best practices across the team, enhancing the overall ZoomInfo selling strategy with your strengths.</li><br/><li>Leverage CRM tools to track and analyze sales activities, providing insights into pipeline health and operational effectiveness.</li><br/><li>Continuously gather intelligence on market trends, competitor activities, and potential opportunities within the mid-market sector.</li><br/><li>Contribute strategic insights to the sales and marketing teams to refine offerings and enhance go-to-market strategies.</li><br/><li>Performs other duties as required/assigned by manager. </li><br/></ul><br/><p><strong>What You Bring:</strong></p><br/><ul><br/><li>3+ years of experience in prospecting and self-sourcing opportunities, with a proven track record of effectively identifying and engaging potential clients in similar markets</li><br/><li>Demonstrated experience in managing complex sales cycles within the mid-market sector, with a proven track record of closing high-value deals</li><br/><li>Strong strategic thinking and problem-solving skills, capable of navigating complex buying environments</li><br/><li>Exceptional negotiation and interpersonal skills, with the ability to manage and influence diverse stakeholder groups</li><br/><li>Proficiency in CRM and sales forecasting tools, with a strong analytical approach to sales management</li><br/><li>Dynamic, motivated individual with a persistent drive to achieve sales targets and contribute to company growth</li><br/></ul><br/><p><strong>This is a hybrid role, working a minimum of three days per week from one of our US offices.</strong></p><br/><p>The US base salary range for this position is $62,500 to $105,000 + variable compensation + benefits ($150,000 - $210,000 OTE (on target earnings)).</p><br/><p>Actual compensation offered will be based on factors such as the candidate’s work location, qualifications, skills, experience and/or training. Your recruiter can share more information about the specific salary range for your desired work location during the hiring process.</p><br/><p>We want our employees and their families to thrive. In addition to comprehensive benefits we offer holistic mind, body and lifestyle programs designed for overall well-being. Learn more about ZoomInfo benefits here.</p><br/><p> </p> <p><strong>About us:</strong> </p><br/><p>ZoomInfo (NASDAQ: GTM) is the Go-To-Market Intelligence Platform that empowers businesses to grow faster with AI-ready insights, trusted data, and advanced automation. Its solutions provide more than 35,000 companies worldwide with a complete view of their customers, making every seller their best seller.</p><br/><p>ZoomInfo may use a software-based assessment as part of the recruitment process. More information about this tool, including the results of the most recent bias audit, is available here.</p><br/><p>ZoomInfo is proud to be an equal opportunity employer, hiring based on qualifications, merit, and business needs, and does not discriminate based on protected status. We welcome all applicants and are committed to providing equal employment opportunities regardless of sex, race, age, color, national origin, sexual orientation, gender identity, marital status, disability status, religion, protected military or veteran status, medical condition, or any other characteristic protected by applicable law. We also consider qualified candidates with criminal histories in accordance with legal requirements.</p><br/><p> </p><br/><p>For Massachusetts Applicants: It is unlawful in Massachusetts to require or administer a lie detector test as a condition of employment or continued employment. An employer who violates this law shall be subject to criminal penalties and civil liability. ZoomInfo does not administer lie detector tests to applicants in any location.</p>"
