Company Name,Job Title,Job Title Normalize,Job URL,Job Description
Clay,Business Recruiter,Recruiter,https://www.linkedin.com/jobs/view/business-recruiter-at-clay-4253815322,"<strong>About Clay<br/><br/></strong>Clay is a creative tool for growth. Our mission is to help businesses grow — without huge investments in tooling or manual labor. We’re already helping over 100,000 people grow their business with Clay. From local pizza shops to enterprises like Anthropic and Notion, our tool lets you instantly translate any idea that you have for growing your company into reality.<br/><br/>We believe that modern GTM teams win by finding <em>GTM alpha</em>—a unique competitive edge powered by data, experimentation, and automation. Clay is the platform they use to uncover hidden signals, build custom plays, and launch faster than their competitors. We’re looking for sharp, low-ego people to help teams find their GTM alpha.<br/><br/><em>Why is Clay the best place to work?<br/><br/></em><ul><li>Customers love the product (100K+ users and growing)</li><li>We’re growing a lot (6x YoY last year, and 10x YoY the two years before that)</li><li>Incredible culture (our customers keep applying to work here)</li><li>Well-resourced (raised a Series B expansion in January 2025 from investors like Sequoia and Meritech)<br/><br/></li></ul>Read more about why people love working at Clay here and explore our wall of love to learn more about the product.<br/><br/><strong>Business Recruiter @ Clay<br/><br/></strong>We're growing fast at Clay, and recruiting is one of the most important things we do. We're looking for a Business Recruiter to help us find and hire incredible people across nontechnical teams. You’ll own the full recruiting cycle, from first outreach to offer letter, and work closely with hiring managers to thoughtfully shape their teams.<br/><br/><strong>What You'll Do<br/><br/></strong><ul><li>Lead full-cycle recruiting for a wide range of business role. Think everything from “GTM Engineer” to “Product Support Specialist” to “Head of Legal”!</li><li>Partner with hiring managers to define roles, shape interview processes, and make great hiring decisions</li><li>Collaborating with leadership on strategic aspects of recruiting. Success in this role isn’t just about filling requisitions, but also about quality of hire and designing effective interview processes</li><li>Help create a thoughtful, consistent, and kind candidate experience from start to finish</li><li>Contribute to the strategic side of recruiting: interview design, quality-of-hire metrics, and how we tell our story to candidates<br/><br/></li></ul><strong>What You'll Bring<br/><br/></strong><ul><li>4+ years of in-house B2B recruiting experience with a strong track record of success</li><li>Excellent written and verbal communication skills</li><li>Sharp interviewing instincts and an ability to identify high-potential candidates—beyond what’s on paper</li><li>A strong sense of candidate experience and a track record of shaping it thoughtfully</li></ul>"
Clay,GTM Engineer (Sales Assist),undefined,https://www.linkedin.com/jobs/view/gtm-engineer-sales-assist-at-clay-4214996902,"<strong>About Clay<br/><br/></strong>Clay is a creative tool for growth. Our mission is to help businesses grow — without huge investments in tooling or manual labor. We’re already helping over 100,000 people grow their business with Clay. From local pizza shops to enterprises like Anthropic and Notion, our tool lets you instantly translate any idea that you have for growing your company into reality.<br/><br/>We believe that modern GTM teams win by finding <em>GTM alpha</em>—a unique competitive edge powered by data, experimentation, and automation. Clay is the platform they use to uncover hidden signals, build custom plays, and launch faster than their competitors. We’re looking for sharp, low-ego people to help teams find their GTM alpha.<br/><br/><em>Why is Clay the best place to work?<br/><br/></em><ul><li>Customers love the product (100K+ users and growing)</li><li>We’re growing a lot (6x YoY last year, and 10x YoY the two years before that)</li><li>Incredible culture (our customers keep applying to work here)</li><li>Well-resourced (raised a Series B expansion in January 2025 from investors like Sequoia and Meritech)<br/><br/></li></ul>Read more about why people love working at Clay here and explore our wall of love to learn more about the product.<br/><br/><strong>GTM Engineer @ Clay<br/><br/></strong>We're hiring a Go-To-Market Engineer for our Sales-Assist team (GTME-SA). This role combines technical expertise with a passion for helping SMB/Mid-Market become Clay customers. The Sales Assist team at Clay is high velocity (you'll be selling Clay to hundreds of customers every quarter). It's the perfect role for someone who loves getting into the nitty gritty of how a business grows revenue and how Clay can help teams unlock growth.<br/><br/>Our current SA GTM Engineers have diverse backgrounds - we've got ex-product managers, professional love coaches, BDRs, and founders. All that is to say, they differ in experience, but they resemble our customers, and they all love GTM hacking.<br/><br/><strong>What You'll Do<br/><br/></strong><ul><li>Drive the Sales motion by helping customers discover and adopt new Clay use cases </li><li>Developing consultative selling skills while staying at the forefront of emerging sales technologies</li><li>Provide technical guidance and support during the sales process for smaller/mid-market accounts</li><li>Collaborate with product teams, translating customer feedback into feature improvements<br/><br/></li></ul><strong>What You'll Bring<br/><br/></strong><ul><li>2+ years of GTM experience (Sales, RevOps, Growth, Marketing, etc.) or a technical role (Product, Solutions/Sales engineering)</li><li>Experience with Clay or relevant GTM tools</li><li>Clear and enthusiastic communication when translating concepts to non-technical users</li><li>Curiosity &amp; enthusiasm (learning something new every day excites you)</li><li>Nice to have: Computer Science/Engineering background or equivalent technical degree</li></ul>"
Clay,GTM Engineer (GTM Ops),undefined,https://www.linkedin.com/jobs/view/gtm-engineer-gtm-ops-at-clay-4272314600,"<strong>About Clay<br/><br/></strong>Clay is a creative tool for growth. Our mission is to help businesses grow — without huge investments in tooling or manual labor. We’re already helping over 100,000 people grow their business with Clay. From local pizza shops to enterprises like Anthropic and Notion, our tool lets you instantly translate any idea that you have for growing your company into reality.<br/><br/>We believe that modern GTM teams win by finding <em>GTM alpha</em>—a unique competitive edge powered by data, experimentation, and automation. Clay is the platform they use to uncover hidden signals, build custom plays, and launch faster than their competitors. We’re looking for sharp, low-ego people to help teams find their GTM alpha.<br/><br/><em>Why is Clay the best place to work?<br/><br/></em><ul><li>Customers love the product (100K+ users and growing)</li><li>We’re growing a lot (6x YoY last year, and 10x YoY the two years before that)</li><li>Incredible culture (our customers keep applying to work here)</li><li>Well-resourced (raised a Series B expansion in January 2025 from investors like Sequoia and Meritech)<br/><br/></li></ul>Read more about why people love working at Clay here and explore our wall of love to learn more about the product.<br/><br/><strong>GTM Engineer (GTM Ops) @ Clay<br/><br/></strong>We’re looking for someone to build the systems that move deals forward.<br/><br/>This role is all about the heart of the funnel: pipeline management, opportunity workflows, deal acceleration, and post-sale handoffs. You’ll work closely with go-to-market leaders to turn high-level goals into real, scalable systems. You’ll spot gaps, solve for edge cases, and make sure the entire funnel—from first meeting to renewal—runs smoothly and intelligently.<br/><br/>What You’ll Do:<br/><br/><ul><li>Build and maintain the systems that power our opportunity management, sales handoffs, forecasting, and post-sale workflows</li><li>Design AI-native automations that surface next-best actions, trigger timely follow-ups, and improve deal velocity</li><li>Connect GTM tools into one cohesive stack—and evolve that stack as we scale</li><li>Work side-by-side with Sales, and Customer teams to translate business needs into technical solutions</li><li>Balance long-term scalability with short-term speed; we’re growing fast, and we need systems that can keep up<br/><br/></li></ul>What You’ll Bring:<br/><br/><ul><li>4+ years of experience in GTM systems, revenue operations, or sales architecture at a fast-moving company</li><li>Built or owned systems that support sales pipelines, post-sale processes, and customer lifecycle ops</li><li>Enjoy working closely with non-technical teams and can turn messy problems into clean system design</li><li>Strong sense of curiosity, tinkering and hacking</li><li>Strong grasp of tools in the modern GTM stack as well as SQL</li><li>Excitement about the potential of AI to make sales and customer workflows smarter and more automated<br/><br/></li></ul>Compensation Range: $140K - $160K<br/><br/>"
Clay,Engineering Manager,Engineering Manager,https://www.linkedin.com/jobs/view/engineering-manager-at-clay-4175732294,"<strong>About Clay<br/><br/></strong>Clay is a creative tool for growth. Our mission is to help businesses grow — without huge investments in tooling or manual labor. We’re already helping over 100,000 people grow their business with Clay. From local pizza shops to enterprises like Anthropic and Notion, our tool lets you instantly translate any idea that you have for growing your company into reality.<br/><br/>We believe that modern GTM teams win by finding <em>GTM alpha</em>—a unique competitive edge powered by data, experimentation, and automation. Clay is the platform they use to uncover hidden signals, build custom plays, and launch faster than their competitors. We’re looking for sharp, low-ego people to help teams find their GTM alpha.<br/><br/><em>Why is Clay the best place to work?<br/><br/></em><ul><li>Customers love the product (100K+ users and growing)</li><li>We’re growing a lot (6x YoY last year, and 10x YoY the two years before that)</li><li>Incredible culture (our customers keep applying to work here)</li><li>Well-resourced (raised a Series B expansion in January 2025 from investors like Sequoia and Meritech)<br/><br/></li></ul>Read more about why people love working at Clay here and explore our wall of love to learn more about the product.<br/><br/><strong>Engineering Manager @ Clay<br/><br/></strong>As a Software Engineering Manager, you will lead and grow a high-performing engineering team as Clay scales through rapid growth. You'll take ownership of the team's mission and objectives, ensuring the team delivers high-quality solutions on time to Clay's most pressing challenges. You'll foster an engaged, motivated, and collaborative team culture while supporting the growth and development of each team member. You’ll work cross-functionally with product, design, support, and other engineering teams to help scale and improve our product. There’ll be no shortage of fun problems to explore and technical challenges to solve.<br/><br/><strong>What You’ll Do<br/><br/></strong><ul><li>Defining team purpose and areas of ownership. You’ll ensure goals are well understood and internalized. You’ll also introduce principles and frameworks for your team to be able to make day-to-day prioritization decisions independently.</li><li>Planning, prioritization and staffing. You’ll set and update the team roadmap (in collaboration with PMs). You’ll also allocate team members to work — determining who works on what and when.</li><li>Building and maintaining the team culture. You’ll build and grow a team that works well together and is motivated. You’ll support team members in achieving their career goals.</li><li>Hiring and onboarding top engineering talent. You’ll actively recruit, interview, and onboard engineers, ensuring new hires ramp up quickly and contribute effectively.</li><li>Contributing to engineering wide initiatives. As an Engineering Manager, you’ll contribute to and lead initiatives that enhance engineering excellence and scalability across the organization.</li><li>Owning the outcomes for your team. You’ll introduce processes to get the important work done smoothly, and keep folks accountable. You’ll interface with the rest of the organization on behalf of the team.<br/><br/></li></ul><strong>What You'll Bring<br/><br/></strong><ul><li>You have 2+ years of management experience and 6+ years of overall software development experience. You’ve managed and coached 3+ direct reports for growth and success in a fast paced environment. You have a track record of building scalable, high-performance systems with a strong focus on customer delight and user experience.</li><li>You are an empathetic communicator. You express nuanced ideas clearly at different levels of abstraction for different audiences. In disagreements, you prioritize curiosity over confrontation, making sure everyone feels heard and understood.</li><li>You’re familiar with our current tech stack or can learn unfamiliar technologies quickly. Our current tech stack is:</li><ul><li>React, Typescript, Python, Node.js</li><li>AWS services: Aurora (Postgres), Elasticache (Redis), Elastic Container Registry (ECR), ECS (Fargate), Lambda, OpenSearch</li><li>IaC: Terraform</li><li>Deployment tools: CircleCI, Netlify, Playwright</li><li>Observability tools: Cloudwatch, Datadog, Mezmo</li></ul></ul>"
Clay,Staff Software Engineer,Staff Software Engineer,https://www.linkedin.com/jobs/view/staff-software-engineer-at-clay-4175726896,"<strong>About Clay<br/><br/></strong>Clay is a creative tool for growth. Our mission is to help businesses grow — without huge investments in tooling or manual labor. We’re already helping over 100,000 people grow their business with Clay. From local pizza shops to enterprises like Anthropic and Notion, our tool lets you instantly translate any idea that you have for growing your company into reality.<br/><br/>We believe that modern GTM teams win by finding <em>GTM alpha</em>—a unique competitive edge powered by data, experimentation, and automation. Clay is the platform they use to uncover hidden signals, build custom plays, and launch faster than their competitors. We’re looking for sharp, low-ego people to help teams find their GTM alpha.<br/><br/><em>Why is Clay the best place to work?<br/><br/></em><ul><li>Customers love the product (100K+ users and growing)</li><li>We’re growing a lot (6x YoY last year, and 10x YoY the two years before that)</li><li>Incredible culture (our customers keep applying to work here)</li><li>Well-resourced (raised a Series B expansion in January 2025 from investors like Sequoia and Meritech)<br/><br/></li></ul>Read more about why people love working at Clay here and explore our wall of love to learn more about the product.<br/><br/><strong>Software Engineering, Staff @ Clay<br/><br/></strong>As a Staff Engineer, you’ll play a key role in driving impact across the engineering organization. You’ll leverage your technical expertise to shape strategic direction, execute ambitious and complex projects, and elevate the overall effectiveness of the team. Your impact will go beyond individual contributions — you’ll shape architecture, mentor engineers, and drive process improvements to enhance efficiency, scalability, and the overall effectiveness of the engineering organization. There’ll be no shortage of fun problems to explore and technical challenges to solve.<br/><br/><strong>What You'll Do<br/><br/></strong><ul><li>Big picture thinking. You’ll take a step back and see beyond the immediate details, the current roadmap, and the individual teams. You’ll set technical strategy for the domains that you cover.</li><li>Executing. The projects you take on may be messier, more ambiguous, or more technically complex. You can bust through obstacles that block others, but you’ll also often have to rely on larger groups of people and/or the trust and influence you have within the organization to succeed and scale your impact.</li><li>Leveling up the team. You’ll influence engineers at the company via teaching, mentoring, reviewing designs and proposals, and reviewing code. You’ll also serve as a role model for the team around ownership, technical designs &amp; implementation, and participation in the company culture.<br/><br/></li></ul><strong>What You'll Bring<br/><br/></strong><ul><li>You have 7+ years of overall software development experience. You’ve worked at startups and scale-ups, and are comfortable building for a continually growing level of scale.</li><li>You have experience in infrastructure. You’re comfortable spinning up new cloud resources, from microservices to queues, caches, and DB clusters, you’re familiar with best practices when it comes to assembling the components of your system designs.</li><li>You have experience with observability tooling. You’ve used logging, profilers, distributed tracing, etc. to track down tricky bugs or performance issues in production systems.</li><li>You have strong product intuition. You have to ability think broadly and cross-functionally around how your technical decisions will impact the end-user product experience both in terms of how existing features work as well as what new functionality could be unlocked.</li><li>You are an empathetic communicator. You express nuanced ideas clearly at different levels of abstraction for different audiences. In disagreements, you prioritize curiosity over confrontation, making sure everyone feels heard and understood. You avoid tying your ego to the systems you’ve built or are trying to build.</li><li>You’re familiar with our current tech stack or can learn unfamiliar technologies quickly. Our current tech stack is:</li><ul><li>Typescript, React, Node.js, Python</li><li>AWS services: Aurora (Postgres), Elasticache (Redis), Docker + Elastic Container Registry (ECR), ECS (Fargate), Lambda, OpenSearch</li><li>IaC: Terraform</li><li>Deployment tools: Github, CircleCI, Netlify, Playwright</li><li>Observability tools: Cloudwatch, Datadog, Mezmo, Grafana</li></ul></ul>"
Clay,Staff Product Designer,Staff Product Designer,https://www.linkedin.com/jobs/view/staff-product-designer-at-clay-4010423524,"<strong>About Clay<br/><br/></strong>Clay is a creative tool for growth. Our mission is to help businesses grow — without huge investments in tooling or manual labor. We’re already helping over 100,000 people grow their business with Clay. From local pizza shops to enterprises like Anthropic and Notion, our tool lets you instantly translate any idea that you have for growing your company into reality.<br/><br/>We believe that modern GTM teams win by finding <em>GTM alpha</em>—a unique competitive edge powered by data, experimentation, and automation. Clay is the platform they use to uncover hidden signals, build custom plays, and launch faster than their competitors. We’re looking for sharp, low-ego people to help teams find their GTM alpha.<br/><br/><em>Why is Clay the best place to work?<br/><br/></em><ul><li>Customers love the product (100K+ users and growing)</li><li>We’re growing a lot (6x YoY last year, and 10x YoY the two years before that)</li><li>Incredible culture (our customers keep applying to work here)</li><li>Well-resourced (raised a Series B expansion in January 2025 from investors like Sequoia and Meritech)<br/><br/></li></ul>Read more about why people love working at Clay here and explore our wall of love to learn more about the product.<br/><br/><strong>Product Design @ Clay<br/><br/></strong>We believe that not enough design thinking has gone into the tools we use to build software. That means that most teams work across a clunky mix of tools and spreadsheets, stuck in monotonous cycles with lots of manual work. You will help us change that.<br/><br/>As an early designer, you’ll get to apply a unique blend of design and product knowledge to re-imagine how working with data in Clay should, and could, feel.<br/><br/>Questions We're Asking &amp; Exploring<br/><br/><ul><li>What are the best to deliver value to our customers and how could they impact our business?</li><li>How can we design a flexible architecture that scales across the features we need to develop to grow our business?</li><li>For example: how can we continue supporting people who want to configure individual enrichments, while also building out the infrastructure to run entire workflows automatically?</li><li>How can we onboard users around a specific use cases and then iteratively introduce them to new capabilities?</li><li>For example: if customers purchase a lower tier, how can we help them discover and understand how features in higher tiers might provide value?</li><li>How do we create abstractions and interfaces that are easy to understand for non-developers?</li><li>For example, how can we illustrate when actions in a workflow are happening in parallel vs. happening sequentially?</li><li>How do we let people move fluidly between the different parts of Clay’s product, creating a seamless experience that sparks delight?<br/><br/></li></ul>What You'll Do<br/><br/><ul><li>Design &amp; ship core features. Design and maintain core features and infrastructure. Given the size of the team, you will be working across the entire product and will have lots of responsibility.</li><li>Collaborate &amp; learn. Partner with the rest of our team, communicate openly, give &amp; receive thoughtful feedback, and learn from people who excel in their areas of expertise.</li><li>Take ownership. We're focused on building a high-trust, ownership focused environment where everyone aims to define what they think is most important to work on, and drive initiatives forward.</li><li>Interview users, analyze feedback, help prioritize the roadmap. Set up, run, and synthesize learnings from user research studies to help inform what use cases and improvements we should focus on.</li><li>Design &amp; prototype novel interfaces. You'll rethink how we can make certain aspects of building software more intuitive to users, which requires you to deeply understand what building software looks like today. This could involve quickly building lightweight prototypes to explore novel interaction patterns that make building software efficient and intuitive.<br/><br/></li></ul>What You'll Bring<br/><br/><ul><li>Clear design process. You can identify the right problems to solve, consider multiple solutions, and speak intelligently about tradeoffs. You develop personal and shared processes in service of a shared higher-level goal, not just for the sake of having a process.</li><li>Excellent communication &amp; collaboration. You’re able to consider different levels of abstraction so your ideas land with your audience. You default to visual communication, but also have excellent verbal and written communication skills. You’re organized and comfortable with both synchronous and asynchronous communication.</li><li>Systems thinking. You can break down complex problems and expose simple interfaces for accomplishing difficult tasks. You see patterns that repeat across the product and are able to abstract them into common interactions. For example, if we auto-fill the best values into certain fields in the product, how can we adapt the same functionality across contexts into the rest of the product?</li><li>Ability to deliver pixel-perfect designs. You care about coming back to something again and again until ""it feels right"", and you inspire your engineering partners to have the same level of care.</li><li>Thinking in interactions, not static screens. You embody the belief that software is not a set of static screens, but rather a responsive system that evolves over time. You deeply understand the nuances of designing for such a medium.</li><li>A customer-focused approach to design. You’re constantly empathizing with customers and checking back in to make sure we're delivering intuitive value.</li><li>8+ years experience in a relevant role.</li></ul>"
