Company Name,Job Title,Job Title Normalize,Job URL,Job Description
Lusha,Data Engineer For Data Group,undefined,https://www.linkedin.com/jobs/view/data-engineer-for-data-group-at-lusha-4181111374,"<strong>Who We Are<br/><br/></strong>Founded in 2016, Lusha grew from a bootstrapped startup to a $1.5B unicorn, backed by $245M in investments and trusted by sales teams at Google, Zendesk, and Yotpo.<br/><br/>Lusha is an AI-powered sales intelligence platform, changing the B2B sales experience with a new approach called Sales Streaming. Allowing salespeople to spend most of their time selling instead of wasting time and effort on manual prospecting.<br/><br/>With 1.5M+ users, 200M+ contacts, and 40K new signups every month, we’re the engine behind modern GTM teams. And we’re just getting started.<br/><br/>We’re looking for a Data Engineer to design and implement high-scale, data-intensive platforms, research and develop algorithmic solutions, and collaborate on key company initiatives. You will play a critical role within Lusha’s core data teams, which are responsible for managing and optimizing Lusha’s fundamental data assets.<br/><br/><strong>Where does this role fit in our vision?<br/><br/></strong>Every role at our company is designed with a clear purpose—to integrate collective efforts into our shared success, functioning as pieces of a collective brain. At Lusha, data is at the heart of everything we do. Our data engineers are responsible for building and maintaining the core products that power our business. The data teams own and manage the pipelines that generate Lusha's assets, with a strong focus on optimizing key company KPIs.<br/><br/>We leverage cutting-edge technologies to build and scale our data infrastructure. In this role, you will work closely with Data Scientists and Data Analysts on a daily basis, collaborating to develop innovative data solutions that drive business impact.<br/><br/><strong>What will you be responsible for?<br/><br/></strong><ul><li>Solve Complex Business Problems with Scalable Data Solutions</li><li>Develop and implement robust, high-scale data pipelines to power Lusha’s core assets.</li><li>Leverage cutting-edge technologies to tackle complex data challenges and enhance business operations.</li><li>Collaborate with Business Stakeholders to Drive Impact</li><li>Work closely with Product, Data Science, and Analytics teams to define priorities and develop solutions that directly enhance Lusha’s core products and user experience.</li><li>Build and Maintain a Scalable Data Infrastructure</li><li>Design and implement scalable, high-performance data infrastructure to support machine learning, analytics, and real-time data processing.</li><li>Continuously monitor and optimize data pipelines to ensure reliability, accuracy, and efficiency.<br/><br/></li></ul>Requirements:<br/><br/><ul><li>3+ years of hands-on experience designing and implementing large-scale, server-side data solutions</li><li>4+ years of programming experience, preferably in Python and SQL, with a strong understanding of data structures and algorithms</li><li>Proven experience in building algorithmic solutions, data mining, and applying analytical methodologies to optimize data processing and insights</li><li>Proficiency with orchestration tools such as Airflow, Kubernetes, and Docker Swarm, ensuring seamless workflow automation</li><li>Experience working with Data Lakes and Apache Spark for processing large-scale datasets – strong advantage</li><li>Familiarity with AWS services (S3, Glue, EMR, Redshift) – nice to have</li><li>Knowledge of tools such as Kafka, Databricks, and Jenkins – a plus</li><li>Strong command of a variety of storage engines, including Relational (PostgreSQL, MySQL), Document-based (MongoDB), Time-series / Search (ClickHouse, Elasticsearch), Key-value (Redis)</li><li>Comfortable working with AI tools and staying ahead of emerging technologies and trends<br/><br/></li></ul>We’re dreamers, innovators, and learners, driven by simplicity, collaboration, and trust.<br/><br/>At Lusha, your work matters. Your voice is heard. And your growth is part of our growth.<br/><br/>Ready to join us? Let’s build the future of sales, together."
Lusha,Data Analyst For Data Group,undefined,https://www.linkedin.com/jobs/view/data-analyst-for-data-group-at-lusha-4252397124,"<strong>Who We Are<br/><br/></strong>Founded in 2016, Lusha grew from a bootstrapped startup to a $1.5B unicorn, backed by $245M in investments and trusted by sales teams at Google, Zendesk, and Yotpo.<br/><br/>Lusha is an AI-powered sales intelligence platform, changing the B2B sales experience with a new approach called Sales Streaming. Allowing salespeople to spend most of their time selling instead of wasting time and effort on manual prospecting.<br/><br/>With 1.5M+ users, 200M+ contacts, and 40K new signups every month, we’re the engine behind modern GTM teams. And we’re just getting started.<br/><br/>We’re looking for a Data Analyst for the Data Group to work alongside top-tier data professionals, data scientists, and data engineering teams. You will be an integral part of the group ecosystem, providing insights that impact hundreds of thousands of users by leveraging advanced data systems.<br/><br/><strong>Where does this role fit in our vision?<br/><br/></strong>Every role at our company is designed with a clear purpose—to integrate collective efforts into our shared success, functioning as pieces of a collective brain. At Lusha, data is everything; it’s at the heart of everything we do. The Data Group is responsible for shaping the experience of a vast and growing community of users who rely on our data daily.<br/><br/>Your responsibility is to help teams optimize key KPIs by enhancing data pipelines through new logic, models, and data sources, ensuring smarter and more impactful data-driven decisions.<br/><br/><strong>What will you be responsible for?<br/><br/></strong><ul><li>Deeply understand the architecture of Lusha Data Group, driving the development of advanced analyses and data models, while collaborating with cross-functional teams to design and implement enrichment logic within our data ecosystem.</li><li>Develop tools, build dashboards, and establish methodologies to analyze user behavior and enhance the data experience for users.</li><li>Leverage Lusha Data Lake to its fullest potential, utilizing cutting-edge data exploration and visualization tools to extract insights and drive data-driven decision-making.<br/><br/></li></ul>Requirements:<br/><br/><ul><li>3+ years of experience as a Data Analyst, preferably in a data-driven tech company with strong product orientation</li><li>Proven experience collaborating closely with Data Engineering teams</li><li>Proficiency in either Python or SQL – required</li><li>Advantage for experience with Python libraries such as Pandas, NumPy, or PySpark</li><li>Alternatively, strong command of SQL, including analytical functions and performance optimization</li><li>Hands-on experience with big data technologies in cloud-based environments such as Databricks, Snowflake, or Redshift – preferred</li><li>Strong analytical thinking with the ability to turn complex data into actionable insights that impact product and business decisions</li><li>(Nice to have) Experience developing or optimizing statistical or machine learning models as part of data pipelines</li><li>AI-savvy – comfortable using AI tools and staying current with emerging trends<br/><br/></li></ul>We’re dreamers, innovators, and learners, driven by simplicity, collaboration, and trust.<br/><br/>At Lusha, your work matters. Your voice is heard. And your growth is part of our growth.<br/><br/>Ready to join us? Let’s build the future of sales, together."
Lusha,Data Engineering Tech Lead,Data Specialist,https://www.linkedin.com/jobs/view/data-engineering-tech-lead-at-lusha-4234401111,"<strong>Who We Are<br/><br/></strong>Founded in 2016, Lusha grew from a bootstrapped startup to a $1.5B unicorn, backed by $245M in investments and trusted by sales teams at Google, Zendesk, and Yotpo.<br/><br/>Lusha is changing the B2B sales experience with a new approach called Sales Streaming. It allows salespeople to search for any lead in the world, then our AI finds them better ones, keeps them streaming and does outreach for them. This means they can now spend most of their time actually selling.<br/><br/>With 1.5M+ users, 200M+ contacts, and 40K new signups every month, we’re the engine behind modern GTM teams. And we’re just getting started.<br/><br/><strong>Where does this role fit in our vision?<br/><br/></strong>At Lusha, data is everything—it’s at the heart of every product decision, every customer insight, and every strategic move we make. The Data Group builds and maintains the core data assets that power our products, from our Company and Contact databases to our Connect and Recommendation systems. This role sits at the forefront of that mission, leading engineering innovation that directly shapes the experience of our growing user base and drives the evolution of Lusha’s intelligent data services.<br/><br/><strong>What will you be responsible for?<br/><br/></strong><ul><li>Lead the design and development of scalable, high-performance data workflows, including both batch pipelines and real-time data products.</li><li>Define, implement, and enforce engineering best practices related to code quality, testing, CI/CD pipelines, observability, and documentation.</li><li>Mentor, support, and grow a team of data engineers, fostering a collaborative and high-performance engineering culture.</li><li>Identify opportunities to create new data assets and features that expand Lusha’s product capabilities and value proposition.</li><li>Drive architectural decision-making in areas of data modeling, storage solutions, and compute resources within cloud environments such as Databricks and Snowflake.</li><li>Collaborate closely with cross-functional stakeholders—including Product, DevOps, and R&amp;D—to ensure effective delivery and platform stability.</li><li>Promote and champion a data-driven mindset across the organization, balancing technical rigor with business context and strategic goals.<br/><br/></li></ul>Requirements:<br/><br/><ul><li>Minimum 5 years of hands-on experience designing, building, and maintaining large-scale data pipelines for both batch processing and streaming use cases.</li><li>Deep expertise in Python and SQL, with a focus on writing clean, performant, and maintainable code.</li><li>Strong analytical and problem-solving skills, with the ability to break down complex technical challenges and align solutions to business objectives.</li><li>Solid background in data modeling, analytics, and designing architectures for scalability, performance, and cost efficiency.</li><li>Practical experience working with modern OLAP systems and cloud data platforms, including Databricks, Snowflake, or BigQuery.</li><li>Familiarity with AI agent protocols (such as A2A, MCP) and LLM-related technologies (e.g., vector databases, embeddings) is a plus.</li><li>AI-savvy, with comfort adopting AI tools and staying current with emerging AI trends and technologies.<br/><br/></li></ul>We’re dreamers, innovators, and learners, driven by simplicity, collaboration, and trust. At Lusha, your work matters. Your voice is heard. And your growth is part of our growth.<br/><br/><strong>Ready to join us? Let’s build the future of sales, together.</strong>"
Lusha,Director of Analytics,Director of Analytics,https://www.linkedin.com/jobs/view/analytics-team-lead-at-lusha-4244579450,"Founded in 2016, Lusha grew from a bootstrapped startup to a $1.5B unicorn, backed by $245M in investments and trusted by sales teams at Google, Zendesk, and Yotpo.<br/><br/>Lusha is changing the B2B sales experience with a new approach called Sales Streaming. It allows salespeople to search for any lead in the world, then our AI finds them better ones, keeps them streaming and does outreach for them. This means they can now spend most of their time actually selling.<br/><br/>With 1.5M+ users, 200M+ contacts, and 40K new signups every month, we’re the engine behind modern GTM teams. And we’re just getting started.<br/><br/><strong>Where does this role fit in our vision?<br/><br/></strong>We’re seeking a highly motivated Director of Analytics with a strong business orientation and deep analytics expertise to elevate our data-driven culture. You’ll lead a growing group of analysts, partner with cross-functional teams, and build innovative solutions that power Lusha’s product-led growth strategy and customer experience.<br/><br/><strong>What will you be responsible for?<br/><br/></strong><ul><li>Lead, mentor, and develop a group of talented analysts—ensuring professional growth, quality deliverables, and a culture of curiosity.</li><li>Define and execute analytics strategies to support PLG motions, drive product adoption, customer retention, and overall business performance.</li><li>Champion the integration of AI-powered analytics tools, transforming how we generate insights and scale impact across teams.</li><li>Collaborate with Product, Growth, Marketing, and Customer Success to uncover data-driven opportunities and influence key decisions.</li><li>Partner with Data Engineering to ensure reliable, scalable infrastructure and tooling for advanced reporting and analytics.</li><li>Conduct deep product analytics—analyzing user journeys, growth funnels, and cohort behavior to drive actionable insights.</li><li>Design, implement, and evaluate experiments (A/B tests) to optimize onboarding, activation, monetization, and retention.<br/><br/></li></ul>Requirements:<br/><br/><ul><li>9+ years of experience in analytics or data science roles, including 3+ years in a managerial position within B2B SaaS companies</li><li>Experience in PLG (Product-Led Growth) environments – strong advantage</li><li>Proven track record in scaling and mentoring high-performing analytics teams, including managers</li><li>Deep understanding of core SaaS metrics, including:</li><li>ARR, NRR, CAC, LTV, retention, churn, and growth loops</li><li>High proficiency in SQL and data visualization tools such as Looker, Tableau, ThoughtSpot, or similar</li><li>Hands-on experience with Amplitude, Mixpanel, and optionally Python or R</li><li>Strong product-first mindset – experienced in working closely with product teams to analyze and optimize user flows</li><li>Exceptional communication skills, with the ability to translate complex data into clear, actionable business insights</li><li>Excellent project management skills – comfortable handling multiple priorities in a dynamic, fast-paced environment</li><li>Bachelor’s or Master’s degree in a quantitative field (e.g., Statistics, Economics, Computer Science) or equivalent practical experience</li><li>AI-savvy: comfortable working with AI tools and staying ahead of emerging trends<br/><br/></li></ul>We’re dreamers, innovators, and learners, driven by simplicity, collaboration, and trust.<br/><br/>At Lusha, your work matters. Your voice is heard. And your growth is part of our growth.<br/><br/>Ready to join us? Let’s build the future of sales, together."
Lusha,Senior FP&A Analyst,Senior Financial Planning Analyst,https://www.linkedin.com/jobs/view/senior-fp-a-analyst-at-lusha-4277206796,"<strong>Who We Are<br/><br/></strong>Founded in 2016, Lusha grew from a bootstrapped startup to a $1.5B unicorn, backed by $245M in investments and trusted by sales teams at Google, Zendesk, and Yotpo.<br/><br/>Lusha is changing the B2B sales experience with a new approach called Sales Streaming. It allows salespeople to search for any lead in the world, then our AI finds them better ones, keeps them streaming and does outreach for them. This means they can now spend most of their time actually selling. With 1.5M+ users, 200M+ contacts, and 40K new signups every month, we’re the engine behind modern GTM teams. And we’re just getting started.<br/><br/>We’re looking for a Senior FP&amp;A Analyst to join our finance team and play a critical role in driving and impacting business success through data-driven insights. As a Senior FP&amp;A, you will partner with our Go-To-Market and will have a direct impact on revenue growth strategies, sales efficiency, and ROI by managing key SaaS performance indicators.<br/><br/>This role will work closely with our Sales and Marketing leadership – to provide strategic financial insights that optimize growth investments and improve revenue performance. You will report to the FP&amp;A Director and be part of the finance team in our Tel Aviv offices.<br/><br/>We’re looking for a self-motivated and proactive individual who thrives in a fast-paced environment and is eager to make a significant impact on the business. If you’re passionate about using financial data to drive strategic decisions, improve GTM efficiency, and accelerate business growth, this is the role for you.<br/><br/>You will:<br/><br/><ul><li>Drive FP&amp;A Strategy – Develop, implement, and lead forecasting, budgeting, and business planning processes to support revenue growth and operational efficiency.</li><li>Develop GTM Insights &amp; KPIs – Identify, track, and analyze SaaS business metrics like LTV/CAC, payback period, pipeline conversion rates, NRR, churn, and ARR growth drivers.</li><li>Enhance Revenue Forecasting – Build data-driven revenue and pipeline models, aligning Sales and Marketing spend with performance impact</li><li>Implement Systems &amp; Best Practices – Identify and implement FP&amp;A tools, automation solutions, and scalable processes to support a fast-growing organization.</li><li>Manage Annual Operating Plan, short-term and long-term business plans and support strategic growth initiatives<br/><br/></li></ul>Requirements:<br/><br/><ul><li>5+ years of FP&amp;A experience, preferably in SaaS, with a strong focus on GTM (Sales &amp; Marketing) teams</li><li>Experience with Product-Led Growth (PLG) strategies or top-of-funnel performance analysis is a strong plus</li><li>Proven track record of impacting business performance (revenue) through financial insights and strategic planning</li><li>Strong business acumen – ability to translate financial data into actionable strategies for GTM teams</li><li>Highly analytical mindset – ability to build, interpret, and present complex financial models and analyze large datasets.</li><li>Deep understanding of SaaS business models, including recurring revenue metrics, pipeline forecasting, and marketing efficiency KPIs</li><li>Hands-on and strategic thinker – comfortable diving into data while also influencing high-level business decisions</li><li>Bachelor’s degree in Economics, Finance, or related field (MBA is a plus)</li><li>Expert Excel skills; extensive experience building financial models and analyzing large data set</li><li>AI-savvy: Demonstrated experience working with AI tools, with a proactive approach to exploring new technologies and staying ahead of emerging AI trends.</li></ul>"
Lusha,Growth Director,Manager,https://www.linkedin.com/jobs/view/growth-director-at-lusha-4266313557,"<strong>Who We Are<br/><br/></strong>Founded in 2016, Lusha grew from a bootstrapped startup to a $1.5B unicorn, backed by $245M in investments and trusted by sales teams at Google, Zendesk, and Yotpo.<br/><br/>Lusha is changing the B2B sales experience with a new approach called Sales Streaming. It allows salespeople to search for any lead in the world, then our AI finds them better ones, keeps them streaming and does outreach for them. This means they can now spend most of their time actually selling.<br/><br/>With 1.5M+ users, 200M+ contacts, and 40K new signups every month, we’re the engine behind modern GTM teams. And we’re just getting started.<br/><br/><strong>Where does this role fit in our vision?<br/><br/></strong>We are looking for a Growth Director to lead the growth strategy of our B2B SaaS product with a Product-Led Growth (PLG) motion. This strategic role is at the heart of our mission to build scalable ROI driven, paid and non-paid organic growth engines. You will play a pivotal role in shaping how millions of users experience Lusha.<br/><br/><strong>What will you be responsible for?<br/><br/></strong><ul><li>Own our paid channels. Grow the monthly budget while maintaining a healthy CAC/LTV ratio via constant optimization and opening new channels.</li><li>Collaborate closely with product, marketing, development, and customer success teams to maximize customer value and optimize the funnel.</li><li>Conduct A/B tests, define and track KPIs, and present actionable insights to senior leadership.</li><li>Drive experimentation frameworks and iterate rapidly to test new ideas.</li><li>Continuously analyze user data to identify improvement areas and lead data-driven growth initiatives.</li><li>Foster a culture of growth thinking and continuous optimization across the company.</li><li>Lead the SEO/GEO initiatives and grow it systematically and consistently.<br/><br/></li></ul>Requirements:<br/><br/><ul><li>7+ years of experience in Growth Marketing, B2B and PLG is an advantage.</li><li>Hands on approach - we’re looking for the perfect balance between strategic thinkers and great executioners</li><li>Strong proficiency with analytics tools such as Amplitude, Google Analytics, Tableau, or similar.</li><li>Proven track record of leading cross-functional projects and executing successful growth strategies.</li><li>Deep understanding of PLG methodologies and user-centric growth funnels.</li><li>Creative thinker with strong problem-solving skills and a bias for action.</li><li>Excellent communication and stakeholder management skills.</li><li>AI-savvy: comfortable working with AI tools and staying ahead of emerging trends.<br/><br/></li></ul>We’re dreamers, innovators, and learners, driven by simplicity, collaboration, and trust.<br/><br/>At Lusha, your work matters. Your voice is heard. And your growth is part of our growth.<br/><br/>Ready to join us? Let’s build the future of sales, together."
